{
  "$schema": "http://json-schema.org/draft-07/schema#",
  "title": "Envelope_for_AnyValue",
  "description": "Outer wrapper for every `--json` response.\n\nExactly one of `data` or `error` is present. The `skip_serializing_if` attributes keep the absent field out of the JSON entirely.",
  "type": "object",
  "required": [
    "schema",
    "timestamp",
    "version"
  ],
  "properties": {
    "data": {
      "description": "Command-specific payload on success."
    },
    "error": {
      "description": "Structured error on failure.",
      "anyOf": [
        {
          "$ref": "#/definitions/ErrorInfo"
        },
        {
          "type": "null"
        }
      ]
    },
    "schema": {
      "description": "Canonical command name, e.g. `\"hydrate\"`, `\"daemon.list\"`.",
      "type": "string"
    },
    "timestamp": {
      "description": "RFC 3339 UTC timestamp with millisecond precision.",
      "type": "string"
    },
    "version": {
      "description": "Semver-ish version of this schema, e.g. `\"1.0\"`.",
      "type": "string"
    }
  },
  "definitions": {
    "ErrorCategory": {
      "description": "Broad classification bucket for Crab errors.\n\nSerializes to lowercase (`\"transient\"`, `\"conflict\"`, and so on) for structured machine-readable error envelopes.",
      "type": "string",
      "enum": [
        "transient",
        "conflict",
        "integrity",
        "permanent",
        "config",
        "transport",
        "staging",
        "lfs",
        "internal",
        "cancelled"
      ]
    },
    "ErrorInfo": {
      "description": "Structured error representation for the JSON error envelope.\n\nPopulated from a `&CrabError` via the `From` impl. Contains the stable error code, classification, human message, retry hint, variant-specific details, and the `std::error::Error::source()` chain.",
      "type": "object",
      "required": [
        "category",
        "code",
        "details",
        "message",
        "retryable",
        "source_chain"
      ],
      "properties": {
        "category": {
          "$ref": "#/definitions/ErrorCategory"
        },
        "code": {
          "type": "string"
        },
        "details": true,
        "message": {
          "type": "string"
        },
        "retryable": {
          "type": "boolean"
        },
        "source_chain": {
          "type": "array",
          "items": {
            "$ref": "#/definitions/ErrorSource"
          }
        }
      }
    },
    "ErrorSource": {
      "description": "One link in the `std::error::Error::source()` chain.",
      "type": "object",
      "required": [
        "message"
      ],
      "properties": {
        "message": {
          "type": "string"
        }
      }
    }
  }
}
