{"schema":"mount.commit","version":"1.0","timestamp":"2026-10-25T02:02:40.275Z","data":{"mountpoint":"/e2e/run/mount","cache_dir":"/root/.crab/mounts/repos/8dd0af08586f","result":{"transaction_id":"publish-1792893759724","commit_oid":"771a9d91b52c8eb6a187e367d1c5f6a749452ad3","pushed":false,"overlay_cleaned":true,"diff":{"changes":[{"path":"model.bin","kind":"modify","size_bytes":4194304,"mode":33188,"has_backing_file":true}],"estimated_upload_bytes":4194304,"deletion_count":0}}}}
