{"schema":"mount.commit","version":"1.0","timestamp":"2026-10-25T02:46:16.221Z","data":{"mountpoint":"/e2e/run/mount","cache_dir":"/root/.crab/mounts/repos/6c65d27a9d75","result":{"transaction_id":"publish-1792896375912","commit_oid":"81995345eeee4182415cbeb9529721e6412519e0","pushed":true,"overlay_cleaned":false,"diff":{"changes":[],"estimated_upload_bytes":0,"deletion_count":0}}}}
