{"schema":"mount.commit","version":"1.0","timestamp":"2026-10-25T05:18:10.621Z","data":{"mountpoint":"/e2e/run/mount","cache_dir":"/root/.crab/mounts/repos/bf6ddba30a50","result":{"transaction_id":"publish-1792905481986","commit_oid":"17d9c735ceed04306c8f463fcbc093ebb1e02b82","pushed":true,"overlay_cleaned":false,"diff":{"changes":[],"estimated_upload_bytes":0,"deletion_count":0}}}}
