{"schema":"mount.commit","version":"1.0","timestamp":"2026-10-25T01:37:36.502Z","data":{"mountpoint":"/e2e/run/mount","cache_dir":"/root/.crab/mounts/repos/36aab468ffd5","result":{"transaction_id":"publish-1792892255869","commit_oid":"0a58171de74e7367df8799c3735c0ec578bde8b6","pushed":true,"overlay_cleaned":true,"diff":{"changes":[{"path":"model.bin","kind":"modify","size_bytes":4194304,"mode":33188,"has_backing_file":true}],"estimated_upload_bytes":4194304,"deletion_count":0}}}}
