{"schema":"mount.commit","version":"1.0","timestamp":"2026-10-25T04:24:53.094Z","data":{"mountpoint":"/e2e/run/mount","cache_dir":"/root/.crab/mounts/repos/3a67a100a54b","result":{"transaction_id":"publish-1792902292591","commit_oid":"a9631db708085abf4d5cd16a3d5a613c96a88690","pushed":true,"overlay_cleaned":true,"diff":{"changes":[{"path":"model.bin","kind":"modify","size_bytes":4194304,"mode":33188,"has_backing_file":true}],"estimated_upload_bytes":4194304,"deletion_count":0}}}}
