{"schema":"mount.commit","version":"1.0","timestamp":"2026-10-25T05:17:59.993Z","data":{"mountpoint":"/e2e/run/mount","cache_dir":"/root/.crab/mounts/repos/bf6ddba30a50","result":{"transaction_id":"publish-1792905470184","commit_oid":"17d9c735ceed04306c8f463fcbc093ebb1e02b82","pushed":false,"overlay_cleaned":true,"diff":{"changes":[{"path":"model.bin","kind":"modify","size_bytes":4194304,"mode":33188,"has_backing_file":true}],"estimated_upload_bytes":4194304,"deletion_count":0}}}}
