{"schema":"mount.commit","version":"1.0","timestamp":"2026-10-25T05:17:59.745Z","data":{"mountpoint":"/e2e/run/mount","cache_dir":"/root/.crab/mounts/repos/e8b50077463b","result":{"transaction_id":"publish-1792905470159","commit_oid":"f3fe547cef5aa53ba4addf8c5f64557219bdd23f","pushed":false,"overlay_cleaned":true,"diff":{"changes":[{"path":"model.bin","kind":"modify","size_bytes":4194304,"mode":33188,"has_backing_file":true}],"estimated_upload_bytes":4194304,"deletion_count":0}}}}
