{"schema":"mount.commit","version":"1.0","timestamp":"2026-10-25T03:34:49.643Z","data":{"mountpoint":"/e2e/run/mount","cache_dir":"/root/.crab/mounts/repos/d90b038c3e80","result":{"transaction_id":"publish-1792899289131","commit_oid":"09bb6c409311139b24e24f155d7168bb43da3987","pushed":false,"overlay_cleaned":true,"diff":{"changes":[{"path":"model.bin","kind":"modify","size_bytes":4194304,"mode":33188,"has_backing_file":true}],"estimated_upload_bytes":4194304,"deletion_count":0}}}}
