{"schema":"mount.commit","version":"1.0","timestamp":"2026-10-25T02:46:15.979Z","data":{"mountpoint":"/e2e/run/mount","cache_dir":"/root/.crab/mounts/repos/de3cc36ade9b","result":{"transaction_id":"publish-1792896375626","commit_oid":"02d874515a8909c5eb47bd1d88a1dd71f75e1903","pushed":true,"overlay_cleaned":false,"diff":{"changes":[],"estimated_upload_bytes":0,"deletion_count":0}}}}
