{"schema":"mount.commit","version":"1.0","timestamp":"2026-10-25T03:34:49.210Z","data":{"mountpoint":"/e2e/run/mount","cache_dir":"/root/.crab/mounts/repos/f7b80796e951","result":{"transaction_id":"publish-1792899288694","commit_oid":"15fa1d360b8170fcc89bc992352efaaaa45bc117","pushed":false,"overlay_cleaned":true,"diff":{"changes":[{"path":"model.bin","kind":"modify","size_bytes":4194304,"mode":33188,"has_backing_file":true}],"estimated_upload_bytes":4194304,"deletion_count":0}}}}
