{"schema":"mount.commit","version":"1.0","timestamp":"2026-10-25T02:46:16.798Z","data":{"mountpoint":"/e2e/run/mount","cache_dir":"/root/.crab/mounts/repos/de3cc36ade9b","result":{"transaction_id":"publish-1792896376276","commit_oid":"04058c62ee961f096d723342b53ce9c3969165d1","pushed":true,"overlay_cleaned":true,"diff":{"changes":[{"path":"model.bin","kind":"modify","size_bytes":4194304,"mode":33188,"has_backing_file":true}],"estimated_upload_bytes":4194304,"deletion_count":0}}}}
