{"schema":"mount.commit","version":"1.0","timestamp":"2026-10-25T01:04:40.682Z","data":{"mountpoint":"/e2e/run/mnt-rw","cache_dir":"/root/.crab/mounts/repos/ca781a3b5eb1","result":{"transaction_id":"publish-1792890275268","commit_oid":"7d53a31c477b6f37b96ea7461751a95d6006275c","pushed":true,"overlay_cleaned":true,"diff":{"changes":[{"path":"archive","kind":"delete","size_bytes":0,"mode":0,"has_backing_file":false},{"path":"archive/base-move.bin","kind":"delete","size_bytes":0,"mode":0,"has_backing_file":false},{"path":"dir-after","kind":"mkdir","size_bytes":0,"mode":493,"has_backing_file":true},{"path":"dir-after/nested","kind":"mkdir","size_bytes":0,"mode":493,"has_backing_file":true},{"path":"dir-after/nested/note.txt","kind":"create","size_bytes":25,"mode":420,"has_backing_file":true},{"path":"generated","kind":"mkdir","size_bytes":0,"mode":493,"has_backing_file":true},{"path":"generated/worker-0.bin","kind":"create","size_bytes":4194304,"mode":420,"has_backing_file":true},{"path":"generated/worker-1.bin","kind":"create","size_bytes":4194304,"mode":420,"has_backing_file":true},{"path":"generated/worker-2.bin","kind":"create","size_bytes":4194304,"mode":420,"has_backing_file":true},{"path":"generated/worker-3.bin","kind":"create","size_bytes":4194304,"mode":420,"has_backing_file":true},{"path":"models/delete-me.bin","kind":"delete","size_bytes":0,"mode":0,"has_backing_file":false},{"path":"models/model-link.bin","kind":"symlink","size_bytes":9,"mode":41471,"has_backing_file":true},{"path":"models/model.bin","kind":"modify","size_bytes":32505856,"mode":33261,"has_backing_file":true},{"path":"models/new-large.bin","kind":"create","size_bytes":8388608,"mode":493,"has_backing_file":true},{"path":"models/sparse-extend.bin","kind":"create","size_bytes":50331648,"mode":493,"has_backing_file":true},{"path":"moved-archive","kind":"rename","size_bytes":0,"mode":16384,"has_backing_file":false},{"path":"moved-archive/base-move.bin","kind":"rename","size_bytes":33554432,"mode":33188,"has_backing_file":false}],"estimated_upload_bytes":108003362,"deletion_count":3}}}}
