{"schema":"mount.commit","version":"1.0","timestamp":"2026-10-25T02:21:57.027Z","data":{"mountpoint":"/e2e/run/mount","cache_dir":"/root/.crab/mounts/repos/9c10e2171258","result":{"transaction_id":"publish-1792894916462","commit_oid":"a10ea92fb8fc8c8561b8bb1ab7310c46326806ae","pushed":true,"overlay_cleaned":true,"diff":{"changes":[{"path":"model.bin","kind":"modify","size_bytes":4194304,"mode":33188,"has_backing_file":true}],"estimated_upload_bytes":4194304,"deletion_count":0}}}}
