{"schema":"mount.commit","version":"1.0","timestamp":"2026-10-25T02:46:15.759Z","data":{"mountpoint":"/e2e/run/mount","cache_dir":"/root/.crab/mounts/repos/6c65d27a9d75","result":{"transaction_id":"publish-1792896375143","commit_oid":"81995345eeee4182415cbeb9529721e6412519e0","pushed":false,"overlay_cleaned":true,"diff":{"changes":[{"path":"model.bin","kind":"modify","size_bytes":4194304,"mode":33188,"has_backing_file":true}],"estimated_upload_bytes":4194304,"deletion_count":0}}}}
