{"schema":"mount.commit","version":"1.0","timestamp":"2026-10-25T01:37:35.551Z","data":{"mountpoint":"/e2e/run/mount","cache_dir":"/root/.crab/mounts/repos/36aab468ffd5","result":{"transaction_id":"publish-1792892255146","commit_oid":"e518790fb58cd6352677eaeb3bf3c67e0256471f","pushed":true,"overlay_cleaned":false,"diff":{"changes":[],"estimated_upload_bytes":0,"deletion_count":0}}}}
