{"schema":"mount.reset","version":"1.0","timestamp":"2026-10-25T01:04:41.218Z","data":{"mountpoint":"/e2e/run/mnt-rw","cache_dir":"/root/.crab/mounts/repos/a387d0142601","diff":{"changes":[{"path":"models/delete-me.bin","kind":"delete","size_bytes":0,"mode":0,"has_backing_file":false},{"path":"models/model.bin","kind":"modify","size_bytes":33554432,"mode":33188,"has_backing_file":true},{"path":"models/reset-new.bin","kind":"create","size_bytes":31,"mode":33188,"has_backing_file":true}],"estimated_upload_bytes":33554463,"deletion_count":1}}}
