{"schema":"mount.commit","version":"1.0","timestamp":"2026-10-25T02:02:40.712Z","data":{"mountpoint":"/e2e/run/mount","cache_dir":"/root/.crab/mounts/repos/3bc841659f27","result":{"transaction_id":"publish-1792893760428","commit_oid":"90610beea0e8d5a8e0bc779c9f3addf5cff7b7f5","pushed":true,"overlay_cleaned":false,"diff":{"changes":[],"estimated_upload_bytes":0,"deletion_count":0}}}}
