{"schema":"mount.commit","version":"1.0","timestamp":"2026-10-25T04:24:52.636Z","data":{"mountpoint":"/e2e/run/mount","cache_dir":"/root/.crab/mounts/repos/a6a53307ce54","result":{"transaction_id":"publish-1792902292347","commit_oid":"18ac3f8477650442d6327287d8ef0ecaea752e12","pushed":true,"overlay_cleaned":false,"diff":{"changes":[],"estimated_upload_bytes":0,"deletion_count":0}}}}
