{"schema":"mount.commit","version":"1.0","timestamp":"2026-10-25T01:15:03.562Z","data":{"mountpoint":"/e2e/run/mount","cache_dir":"/root/.crab/mounts/repos/40aa34d49f6a","result":{"transaction_id":"publish-1792890901827","commit_oid":"a3c7af2ee68061d12b2cdfb9564b00400270bf16","pushed":false,"overlay_cleaned":true,"diff":{"changes":[{"path":"models/model.bin","kind":"modify","size_bytes":32505856,"mode":33261,"has_backing_file":true}],"estimated_upload_bytes":32505856,"deletion_count":0}}}}
