{"schema":"mount.commit","version":"1.0","timestamp":"2026-10-25T03:34:49.696Z","data":{"mountpoint":"/e2e/run/mount","cache_dir":"/root/.crab/mounts/repos/f7b80796e951","result":{"transaction_id":"publish-1792899289363","commit_oid":"15fa1d360b8170fcc89bc992352efaaaa45bc117","pushed":true,"overlay_cleaned":false,"diff":{"changes":[],"estimated_upload_bytes":0,"deletion_count":0}}}}
