{"schema":"mount.commit","version":"1.0","timestamp":"2026-10-25T05:33:18.174Z","data":{"mountpoint":"/e2e/run/mount","cache_dir":"/root/.crab/mounts/repos/ac2d246feee3","result":{"transaction_id":"publish-1792906395437","commit_oid":"404c41197b4360fedeeb788b6f59e72e3990e507","pushed":false,"overlay_cleaned":true,"diff":{"changes":[{"path":"model.bin","kind":"modify","size_bytes":4194304,"mode":33188,"has_backing_file":true}],"estimated_upload_bytes":4194304,"deletion_count":0}}}}
