{"schema":"mount.commit","version":"1.0","timestamp":"2026-10-25T02:21:56.145Z","data":{"mountpoint":"/e2e/run/mount","cache_dir":"/root/.crab/mounts/repos/ce42061cd8cd","result":{"transaction_id":"publish-1792894915868","commit_oid":"e0d0ca5265ecfc08690d6b14c67d2e0a78e2051b","pushed":true,"overlay_cleaned":false,"diff":{"changes":[],"estimated_upload_bytes":0,"deletion_count":0}}}}
