{"schema":"mount.commit","version":"1.0","timestamp":"2026-10-25T04:24:52.314Z","data":{"mountpoint":"/e2e/run/mount","cache_dir":"/root/.crab/mounts/repos/3a67a100a54b","result":{"transaction_id":"publish-1792902292013","commit_oid":"ab647b91d86969044d8f669e776b2470c7d8a1bd","pushed":true,"overlay_cleaned":false,"diff":{"changes":[],"estimated_upload_bytes":0,"deletion_count":0}}}}
